{
  "selected_story_id": "S5-001",
  "decision": "PASS",
  "confidence": "high",
  "contract_refs_checked": [
    "CONTRACT.md ยง4.2 Fee-Aware Execution",
    "CONTRACT.md Fee Cache Staleness (Fail-Closed)",
    "AT-031", "AT-032", "AT-033", "AT-042", "AT-244", "AT-246"
  ],
  "scope_check": {
    "changed_files": [
      "crates/soldier_core/src/risk/fees.rs",
      "crates/soldier_core/src/risk/mod.rs",
      "crates/soldier_core/tests/test_fee_staleness.rs",
      "crates/soldier_infra/src/deribit/account_summary.rs",
      "crates/soldier_infra/src/deribit/mod.rs",
      "crates/soldier_infra/tests/test_fee_cache.rs"
    ],
    "out_of_scope_files": [],
    "notes": ["Changes scoped to risk/fees in soldier_core and deribit/account_summary in soldier_infra"]
  },
  "verify_check": {
    "verify_post_present": true,
    "verify_post_green": true,
    "notes": ["Full verify passed, 325 workspace tests pass, clippy clean, fmt clean"]
  },
  "pass_flip_check": {
    "requested_mark_pass_id": "S5-001",
    "prd_passes_before": false,
    "prd_passes_after": true,
    "evidence_required": [
      "Fresh cache uses actual rate (AT-244)",
      "Soft-stale applies fee_stale_buffer (AT-032)",
      "Hard-stale sets RiskState::Degraded (AT-033)",
      "Missing timestamp is hard-stale (AT-042)",
      "Epoch-ms survives restart (AT-031)",
      "Fee tier update within one cycle (AT-246)"
    ],
    "evidence_found": [
      "Fresh cache: actual rate, Healthy (test_at244_fresh_cache_uses_actual_rate)",
      "Soft-stale: buffered rate = rate * 1.20 (test_at032_soft_stale_applies_buffer)",
      "Buffer not applied when fresh (test_at032_buffer_not_applied_when_fresh)",
      "Hard-stale: Degraded (test_at033_hard_stale_sets_degraded)",
      "Missing timestamp: HardStale + Degraded (test_at042_missing_timestamp_is_hard_stale)",
      "Epoch-ms restart: correct age across restart (test_at031_staleness_survives_restart)",
      "No monotonic underflow (test_at031_no_monotonic_reset_underflow)",
      "Clock skew fails closed (test_clock_skew_fails_closed)",
      "Fee tier update: new rates immediately available (test_at246_fee_tier_update_within_one_cycle)",
      "19 tests across staleness and cache"
    ],
    "evidence_missing": [],
    "decision_on_pass_flip": "ALLOW"
  },
  "violations": [],
  "required_followups": [],
  "rationale": [
    "Fee staleness matches CONTRACT.md ยง4.2 specification",
    "Three-tier staleness: Fresh / SoftStale / HardStale",
    "Fail-closed on missing timestamp or clock skew",
    "Epoch-ms timestamps survive process restart"
  ]
}
