{
  "selected_story_id": "S3-001",
  "decision": "PASS",
  "confidence": "high",
  "contract_refs_checked": [
    "CONTRACT.md §1.4.4 C Post-only behavior",
    "CONTRACT.md AT-916"
  ],
  "scope_check": {
    "changed_files": [
      "crates/soldier_core/src/execution/post_only_guard.rs",
      "crates/soldier_core/src/execution/mod.rs",
      "crates/soldier_core/tests/test_post_only_guard.rs"
    ],
    "out_of_scope_files": [],
    "notes": [
      "All changes scoped to execution post-only guard within soldier_core"
    ]
  },
  "verify_check": {
    "verify_post_present": true,
    "verify_post_green": true,
    "notes": [
      "Full verify passed: run_id 20260208_213052",
      "204 workspace tests pass, clippy clean, fmt clean"
    ]
  },
  "pass_flip_check": {
    "requested_mark_pass_id": "S3-001",
    "prd_passes_before": false,
    "prd_passes_after": true,
    "evidence_required": [
      "post_only=true and limit price crosses book → reject",
      "post_only=true and limit price does not cross → allow",
      "test_post_only_crossing_rejected passes"
    ],
    "evidence_found": [
      "Buy crosses if limit_price >= best_ask (test_at916_buy_crosses_at_ask_rejected, _above_ask)",
      "Sell crosses if limit_price <= best_bid (test_at916_sell_crosses_at_bid_rejected, _below_bid)",
      "Non-crossing prices allowed (test_buy_below_ask_allowed, test_sell_above_bid_allowed)",
      "Empty book side → cannot cross → allowed (test_buy_no_ask_allowed, test_sell_no_bid_allowed)",
      "post_only=false → skip check (test_not_post_only_always_allowed)",
      "PostOnlyMetrics tracks rejection counter",
      "14 tests cover crossing, non-crossing, empty book, metrics, determinism"
    ],
    "evidence_missing": [],
    "decision_on_pass_flip": "ALLOW"
  },
  "violations": [],
  "required_followups": [],
  "rationale": [
    "Post-only crossing guard matches CONTRACT.md §1.4.4 C exactly",
    "Buy: limit_price >= best_ask → cross; Sell: limit_price <= best_bid → cross",
    "Empty book handled safely (cannot cross → allowed)",
    "AT-916: deterministic rejection before dispatch"
  ]
}
