{
  "selected_story_id": "S1-007",
  "decision": "PASS",
  "confidence": "high",
  "contract_refs_checked": [
    "CONTRACT.md AT-920"
  ],
  "scope_check": {
    "changed_files": [
      "crates/soldier_core/src/execution/dispatch_map.rs",
      "crates/soldier_core/src/execution/mod.rs",
      "crates/soldier_core/tests/test_dispatch_map.rs"
    ],
    "out_of_scope_files": [],
    "notes": [
      "All changes scoped to execution dispatch mapping within soldier_core"
    ]
  },
  "verify_check": {
    "verify_post_present": true,
    "verify_post_green": true,
    "notes": [
      "Full verify passed: run_id 20260208_204209",
      "95 workspace tests pass, clippy clean, fmt clean"
    ]
  },
  "pass_flip_check": {
    "requested_mark_pass_id": "S1-007",
    "prd_passes_before": false,
    "prd_passes_after": true,
    "evidence_required": [
      "Contracts/amount mismatch detection with tolerance=0.001",
      "Rejection with ContractsAmountMismatch error on mismatch",
      "RiskState::Degraded returned on mismatch (via caller)",
      "order_intent_reject_unit_mismatch_total counter increments",
      "Mismatch delta included in error for deterministic propagation",
      "Tests for mismatch, tolerance boundary, counter, skip conditions"
    ],
    "evidence_found": [
      "validate_and_dispatch checks contracts*multiplier vs canonical_amount",
      "CONTRACTS_AMOUNT_MATCH_TOLERANCE=0.001 constant",
      "DispatchMapError::ContractsAmountMismatch{delta} variant",
      "MismatchMetrics with reject_unit_mismatch_total counter",
      "Delta included in ContractsAmountMismatch error variant",
      "10 new AT-920 tests covering all paths"
    ],
    "evidence_missing": [],
    "decision_on_pass_flip": "ALLOW"
  },
  "violations": [],
  "required_followups": [],
  "rationale": [
    "AT-920 mismatch rejection implemented with fail-closed semantics",
    "Tolerance constant matches CONTRACT.md specification (0.001)",
    "Counter metric tracks rejections for observability",
    "Error includes delta for deterministic debugging",
    "Skip conditions (no contracts, no multiplier) are correct and tested"
  ]
}
